because the cost of buying put options eats into an investor's profit 	stock prices rise.	1	when
the investor simply sells the stock at a loss and simultaneously sells the put at a profit.	a stock falls below the put's strike price,	1	when
the government deficit would have totaled about #2.5 billion in the first six months, compared with #1.3 billion a year earlier,	Excluding those receipts,	1	when
Second, a long-term shareholder of a good company needn't worry too much 	the stock price drops temporarily:	1	when
Or perhaps Wall Street,	it has suffered enough,	3	when
faced by Audi salespeople 	the car was tainted by false charges of sudden acceleration,	3	when
and it suffered huge losses 	sales turned down instead of rising.	3	when
it's hard to go with Wang.	a company realizes that,	1	when
who spare no invective 	"taking on local luminaries such as Michael ""Pee Wee"" Dukakis, or New England Patriots Coach Raymond ""Rev. Ray"" Berry,"	1	when
It is easy to fight 	you don't have any other option.	1	when
Mr. Noriega's relationship to American intelligence agencies became contractual in either 1966 or 1967,	His commanding officer at the Chiriqui Province garrison, Major Omar Torrijos, gave him an intriguing assignment: Mr. Noriega would organize the province's first intelligence service.	3	when
intelligence experts always insisted that his allegiance was first to the Americans.	U.S. diplomats complained to the CIA of Col. Noriega's moonlighting,	1	when
Yesterday's edition provided analysts' estimates for the company 	actual earnings were available.	1	when
the decline for black males was 14.2%.	Measured the same way,	1	when
Walker Merryman, a vice president of the Tobacco Institute, said new efforts to restrict tobacco advertising in the U.S. could violate the First Amendment protection of free speech.	Asked for comment,	3	when
society and government are underreacting 	it comes to substantive policy change.	1	when
Coca-Cola Enterprises' volume, measured by cases of soda, rose only 1%.	Excluding that bottling business,	1	when
which cuts the value of overseas profit 	it is translated into dollars.	1	when
"an Eastern spokeswoman said ""we totally disagree."	Asked about the consultants' reports,	3	when
the trustee of the individual retirement account must file forms 5498 reporting market values relating to the decedent and each beneficiary, with copies to the executor and beneficiaries.	AN IRA OWNER dies,	3	when
Thomas H. McFall of Bryan, Texas, told the Tax Court he had understated his income.	Asked how he made charitable gifts of $26,350 out of reported two-year income of $46,892,	3	when
export log and lumber markets will be weak, while panel and plywood markets will be stronger.	Looking ahead to the fourth quarter,	1	when
the government tells us to forget it.	there are well problems, light problems, road problems,	1	when
that it's difficult to structure new Remics 	prices are moving widely.	1	when
"One new investment style called ""asset allocation"" shifts portfolio weightings between stocks, bonds and cash "	computer models say one is more attractive.	1	when
the firm reduced those stock holdings to about 70%.	they did,	3	when
by selling futures 	stock prices dropped 	1	when
it will display a screen 	a user logs on 	3	when
Essentially, Mr. Freeman had invested heavily in the Beatrice leveraged buy-out,	"he was told by another prominent trader, Bernard ""Bunny"" Lasker, that the deal was in trouble."	3	when
this method has the undeniable strengths of factual specificity and avoidance of overgeneralization.	only civil liability is involved,	1	when
it does not see the potentially enormous number of other cases that will be covered by the expanded rule.	a court decides that a particular actor's conduct was culpable and so extends the definition of insider trading to reach this conduct,	1	when
Predictably,	confronted with morally dubious behavior,	1	when
how Ford reacts 	GM, the world's largest auto maker, firms up its proposed deal with Jaguar.	3	when
he crosses his hands and hits a resonant bass note with his right hand.	Mr. Glass decides to get really fancy,	1	when
the music has an appropriate eeriness,	used as background in this way,	1	when
however, the music lacks the resonance provided by a context within another medium.	Served up as a solo,	1	when
Thus, you do the public a great disservice 	Mr. Greve suggests, even facetiously, that the Clean Water Act prohibits the preparation of a scotch and water;	3	when
the high page cost is a major deterrent for advertisers,	ad dollars are tight,	1	when
However,	negotiations bogged down recently,	3	when
President Carter was so scared that the shah's ghost would blame him for shoving him out to make way for the ayatollah that he declared the Carter Doctrine.	the shah died,	3	when
that 	excluding unusual gains in both quarters,	1	when
However,	excluding the year-earlier charge for recall of steering gear,	1	when
In fact, Aer Lingus started ferrying Russians from Shannon to New York 	Washington stripped Aeroflot of its U.S. landing rights.	3	when
Armco convinced a steel service center to build a processing plant nearby 	they determined that GM needed parts more quickly,	3	when
that 	he hit his first career home run last season,	3	when
you see every ball tremendously,	you're in the groove,	1	when
earnings were about 65 cents a share,	Excluding the $2 billion provision and allowing for the taxes Morgan paid,	1	when
"an aide for Mrs. Hills said the panel had clearly ruled that the Canadian trade restrictions ""are illegal."	Questioned about the seeming contradiction in the U.S. and Canadian government views of the panel's report,	3	when
to pay no heed,	duty calls,	1	when
Big Board officials were self-congratulatory about how well the day had gone.	it was all over 	3	when
"the unfortunate victim replied, ""It was a combination of things."	"asked ""What went wrong?"""	3	when
The national economic interests are much better served 	allowing the private interests of bankers and investors be the ultimate judges of the investment quality of various LBO deals and leveraged restructurings.	1	when
If New York doesn't collapse, I see maybe another 5% on the downside,	not counting the risk of bad news out of China,	1	when
which each fell more than 20% 	they reopened for trading yesterday 	3	when
bonds prices fell as the stock market regained strength.	the market opened here,	3	when
"the money manager says, ""I don't know."	Asked what stocks the computer bought,	3	when
even central banks can't stop it.	the dollar is in a free-fall,	1	when
it cracked every model we had for the marketplace,	the airline information came through,	3	when
by buying futures 	futures prices fall,	3	when
Quantum's annual profit fluctuates by about 85 cents a share, provided no other variables are changing.	the price of polyethylene moves a mere penny a pound,	1	when
"a BP spokesman says, ""We pretty much have a policy of not commenting on rumors, and I think that falls in that category."	Asked about a bid for Quantum,	3	when
P&G's share of the Japanese market fell to about 8% from more than 20%.	Attack hit the shelves in 1987,	3	when
"the executive replied, ""That isn't the reason Dreyfus has been brought in. He was brought in to turn around the company."	Asked about the speculation that Mr. Louis-Dreyfus has been hired to pave the way for a buy-out by the brothers,	3	when
her uncles moved in -- and let her make the sleeping and other household arrangements.	Rosie died,	3	when
"Mr. Crandall smiled broadly and said: ""No comment."	Asked whether Friday's action could help him avoid being Trumped by the New York real estate magnate,	3	when
Sen. Christopher Dodd called the State Department for a briefing.	the news broke of an attempted coup in Panama two weeks ago,	3	when
Although viewership soars 	big news breaks,	3	when
you leave the realm of reporting and enter the orbit of speculation.	you suggest otherwise,	1	when
by not renewing more than $1 billion of brokered certificates of deposit 	they come due.	3	when
But 	something is inevitable,	1	when
a modest increase 	compared with the sizzling expansion of years past.	1	when
"New Mexico Sen. Pete Domenici, the ranking Republican on the Senate Budget Committee, said, ""We're looking like idiots. Things had just gone too far."	Asked why senators were giving up so much,	3	when
a court may order the defendant to testify.	Absent the risk of such prosecution,	1	when
Denver-based portfolio manager James Craig wasn't daunted 	Friday's rout shaved $40 million from the value of the $752 million Janus Fund he oversees.	3	when
Oregon Sen. Bob Packwood, the ranking GOP member of the tax-writing Senate Finance Committee, hailed it.	an agreement was reached to strip capital gains from the legislation,	3	when
"he curtly replied: ""The adminstration will have to speak for itself."	Asked if the administration agreed,	3	when
to buy in 	the panic wears off.	3	when
the big guys hurt badly.	the little guy gets frightened,	3	when
Once bitten, 2,000 times shy.	it comes to money:	1	when
Typically, a margin call occurs 	the price of a stock falls below 75% of its original value.	3	when
by all tradition, the economy followed.	it went down,	3	when
these youth are not performing service.	Strictly speaking,	1	when
"Mr. Darman replied: ""It is a non-answer. But, in this context, that's the smart thing to do."	"it was suggested his comment was a ""non-answer,"	3	when
and 	emotion starts to run,	1	when
and buy stocks 	they plunge.	3	when
But put-option prices may zoom 	trading resumes today.	3	when
His recording later turned up as a court exhibit.	"Seeking to keep Justin's ""My Own"" product line off the U.S. market, Sony last May filed a suit in Manhattan federal court accusing the upstart of trademark infringement, unfair competition and other violations of business law."	3	when
insurance companies will be leading it 	the rally comes,	3	when
however, the notion transmogrified into a promised assault, with targets primarily for political gains, not justice.	reduced to buzzword status in ex parte pledges,	3	when
But 	the company revealed Lisa's poor sales late in 1983,	3	when
but that the plant can be reactivated quickly 	the market improves.	3	when
the local real-estate market gets pneumonia.	a regional economy catches cold,	1	when
these real-estate indicators will rebound far faster than the improving economy.	a region's economy rebounds from a slowdown,	1	when
that most companies and individuals make these decisions 	confident of future economic stability and growth.	1	when
business and consumer confidence will return,	Denver's regional economy begins to grow faster 	3	when
I expect to be fully exonerated.	all is said and done,	3	when
toy makers from Hong Kong were among the first to march in.	China opened its doors to foreign investors in 1979,	3	when
He spoke up again 	the Sony bid for Columbia was announced.	3	when
